"Indicator","Country","2000_value","2000_notes","2000_source","2001_value","2001_notes","2001_source","2002_value","2002_notes","2002_source","2003_value","2003_notes","2003_source","2004_value","2004_notes","2004_source","2005_value","2005_notes","2005_source","2006_value","2006_notes","2006_source","2007_value","2007_notes","2007_source","2008_value","2008_notes","2008_source","2009_value","2009_notes","2009_source","2010_value","2010_notes","2010_source","2011_value","2011_notes","2011_source","2012_value","2012_notes","2012_source","2013_value","2013_notes","2013_source","2014_value","2014_notes","2014_source","2015_value","2015_notes","2015_source","2016_value","2016_notes","2016_source","2017_value","2017_notes","2017_source","2018_value","2018_notes","2018_source","2019_value","2019_notes","2019_source"
"Fixed-broadband subscriptions","Sao Tome and Principe","","","","","","","","","","","","","","","","","","","125","","","308","","ITU estimate.","344","","Autoridade Geral de Regulação","443","","Autoridade Geral de Regulação","585","","Autoridade Geral de Regulação","737","","Autoridade Geral de Regulação","778","","Autoridade Geral de Regulação","978","","Autoridade Geral de Regulação","1100","","ITU estimate.","1314","","Autoridade Geral de Regulação","1425","","AGER - Autoridade Geral de Regulação","1479","","AGER - Autoridade Geral de Regulação","1557","","AGER - Autoridade Geral de Regulação","1642","","AGER - Autoridade Geral de Regulação"
"Fixed-broadband subscriptions","Saudi Arabia","","","","14000","","Saudi Telecommunications Company.","34782","","Saudi Telecommunications Company.","45982","","Saudi Telecommunications Company.","68700","","Saudi Telecommunications Company.","67798","","ITU estimate.","218176","","CITC Market Studies Department.","623116","","CITC Market Studies Department.","1048098","","CITC Market Studies Department.","1437718","","CITC","1711598","","Communication and Information Technology Commission","1951457","","Communication and Information Technology Commission","2540151","","Communication and Information Technology Commission","","","","","","","6335557","Includes subscriptions to fixed LTE.","Communication and Information Technology Commission","6397541","","Communications and Information Technology Commission (CITC)","6653291","","Communications and Information Technology Commission (CITC)","6821873","","Communications and Information Technology Commission (CITC)","6801949","","Communications and Information Technology Commission (CITC)"
"Fixed-broadband subscriptions","Senegal","","","","","","","1200","","","2383","","","7665","","","18028","","","28926","","","38132","","Agence de Régulation des Télécommunications et des Postes.","47358","","Agence de Régulation des Télécommunications et des Postes.","58720","","Agence de Régulation des Télécommunications et des Postes.","78647","","Agence de Régulation des Télécommunications et des Postes (ARTP)","92713","","Agence de Régulation des Télécommunications et des Postes (ARTP)","95561","","Autorité de Régulation des Télécommunications et des Postes (ARTP)","106733","","Autorité de Régulation des Télécommunications et des Postes (ARTP)","103362","","Autorité de Régulation des Télécommunications et des Postes (ARTP)","100611","","Autorité de Régulation des Télécommunications et des Postes (ARTP)","98353","","ARTP","111795","","ARTP","129820","","ARTP","152047","","ARTP"
"Fixed-broadband subscriptions","Serbia","","","","","","","","","","","","","","","","33486","","","121727","","Republic Telecommunication Agency RATEL.","325730","","Republic Telecommunication Agency RATEL.","457181","","Republic Telecommunication Agency RATEL.","590586","","Republic Telecommunication Agency RATEL.","859892","","Republic Agency for Electronic Communications (RATEL)","970407","","Republic Agency for Electronic Communications (RATEL)","1063977","","Republic Agency for Electronic Communications (RATEL)","1173635","","Regulatory  Agency for Electronic Communications and Postal Services (RATEL)","1191078","","Regulatory  Agency for Electronic Communications and Postal Services (RATEL)","1320230","","Regulatory  Agency for Electronic Communications and Postal Services (RATEL)","1450958","","Regulatory Agency for Electronic Communications and Postal Services","1480754","","Regulatory Agency for Electronic Communications and Postal Services","1552160","","Regulatory Agency for Electronic Communications and Postal Services","1623790","","Regulatory Agency for Electronic Communications and Postal Services"
"Fixed-broadband subscriptions","Seychelles","","","","","","","","","","","","","349","","Ministry of Information Technology and Communication.","948","","Ministry of Information Technology and Communication.","2475","","Ministry of Information Technology and Communication.","3493","Jan 2008.","MInistry of National Development","3417","Jan 2009.","MInistry of National Development","4554","Jan 2010.","MInistry of National Development","6793","Jan 2011.","Vice President's Office Department of Information Communication Technology","9412","","Department of Information Communications Technology at Vice President's Office","10577","","Office of the President; Department of Information Communications Technology","12411","","Office of the President; Department of Information Communications Technology","11827","","Office of the President; Department of Information Communications Technology","13420","","Office of the President; Department of Information Communications Technology","14035","","Office of  the Vice President; Department of Information Communication Technology","15221","","Office of  the Vice President; Department of Information Communication Technology","19689","","Office of  the Vice President; Department of Information Communication Technology","26974","","Office of  the Vice President; Department of Information Communication Technology"
"Fixed-broadband subscriptions","Sierra Leone","","","","","","","","","","","","","","","","","","","","","","","","","","","","","","","","","","","","","","","","","","","","","","","","","","","","","","National Telecommunications Commission","","","National Telecommunications Commission","","","National Telecommunications Commission"
"Fixed-broadband subscriptions","Singapore","69000","","","151000","","","270000","","","417100","","","545200","","","656200","","","787900","","","926000","","IDA.","1071200","","Infocomm Development Authority of Singapore","1233500","","Infocomm Development Authority of Singapore","1338400","","Infocomm Development Authority of Singapore","1408200","","Infocomm Development Authority of Singapore","1432800","","Infocomm Development Authority of Singapore","1493400","","Infocomm Development Authority of Singapore","1474000","","Infocomm Development Authority of Singapore","1486200","","Infocomm Development Authority of Singapore","1591900","Data is as at Mar 2017","Infocomm Media Development Authority","1475700","Data is as at end Mar 2018","Infocomm Media Development Authority","1493600","Data is as at end Mar 2019","Infocomm Media Development Authority","1504000","Data is as at end Mar 2020","Infocomm Media Development Authority"
"Fixed-broadband subscriptions","Slovakia","","","","","","","4083","","Ministry of Transport; Posts and Telecommunications.","22461","","Ministry of Transport; Posts and Telecommunications.","78764","","Ministry of Transport; Posts and Telecommunications.","181538","","Ministry of Transport; Posts and Telecommunications.","304615","","OECD.","546664","","Ministry of Transport; Posts and Telecommunications.","604688","From this year excluding fixed wireless.","Ministry of Transport; Construction and Regional Development of the Slovak Republic","775056","","Ministry of Transport; Construction and Regional Development of the Slovak Republic","876953","","Ministry of Transport; Construction and Regional Development of the Slovak Republic","953098","","Ministry of Transport; Construction and Regional Development of the Slovak Republic","1045490","","Ministry of Transport; Construction and Regional Development of the Slovak Republic","1109060","","Ministry of Transport; Construction and Regional Development of the Slovak Republic","1191216","","Ministry of Transport; Construction and Regional Development of the Slovak Republic","1273812","","Ministry of Transport; Construction and Regional Development of the Slovak Republic","1336541","","Ministry of Transport and Construction of the Slovak Republic","1404751","","Ministry of Transport and Construction of the Slovak Republic","1507998","","Ministry of Transport and Construction of the Slovak Republic","1585092","","Ministry of Transport and Construction of the Slovak Republic"
"Fixed-broadband subscriptions","Slovenia","","","","5500","","","56735","","","57992","","","115069","","","196650","","","279814","","","344677","","Post and Electronic Communications Agency of the Republic of Slovenia.","425294","","Post and Electronic Communications Agency of the Republic of Slovenia","449030","","Post and Electronic Communications Agency of the Republic of Slovenia","470527","","Post and Electronic Communications Agency of the Republic of Slovenia","494372","","Agency for Communication Networks and Services of the Republic of Slovenia","509336","","Agency for Communication Networks and Services of the Republic of Slovenia","524621","","Agency for Communication Networks and Services of the Republic of Slovenia","555815","","Agency for Communication Networks and Services of the Republic of Slovenia","569026","","Agency for Communication Networks and Services of the Republic of Slovenia","589324","","AKOS","601820","","AKOS","612745","","AKOS","627939","","AKOS"
"Fixed-broadband subscriptions","Solomon Islands","","","","","","","","","","","","","200","","Solomon Telekom Company Ltd.","450","","Solomon Telekom Company Ltd.","650","","ITU estimate.","1000","","Solomon Telekom Company Ltd.","1500","","ITU estimate.","2000","","ITU estimate.","2522","","Telecommunications Commission of the Solomon Islands","2430","","Telecommunications Commission of the Solomon Islands","2132","","Telecommunications Commission of the Solomon Islands","1884","","Telecommunications Commission of the Solomon Islands","1335","","Telecommunications Commission of the Solomon Islands","1420","","Telecommunications Commission of the Solomon Islands","1639","","Telecommunications Commission of the Solomon Islands","1166","","Telecommunications Commission Solomon Islands","1488","","Telecommunications Commission Solomon Islands","1045","include wireless hotspots","Telecommunications Commission Solomon Islands"
"Fixed-broadband subscriptions","Somalia","","","","","","","","","","","","","","","","","","","","","","","","","","","","","","","","","","","","","40000","","Ministry of Information; Posts and Telecommunications","60000","","Ministry of Information; Posts and Telecommunications","70000","","Ministry of Posts and Telecommunications","82000","","ITU estimate.","92000","","National Communication Authority (NCA)","98000","","National Communications Authority","","","","","",""
"Fixed-broadband subscriptions","South Africa","","","","","","","2669","","Independent Communications Authority of South Africa (ICASA).","20313","","Independent Communications Authority of South Africa (ICASA).","60000","","Independent Communications Authority of South Africa (ICASA).","165290","","Independent Communications Authority of South Africa (ICASA).","335112","","Independent Communications Authority of South Africa (ICASA).","378000","","Independent Communications Authority of South Africa (ICASA).","426000","","Independent Communications Authority of South Africa (ICASA).","481000","","ITU estimate.","743000","","ICASA based on Ovum data.","907000","","ITU estimate.","1107200","","ITU estimate.","1615210","","Independent Communications Authority of South Africa","1706313","","Independent Communications Authority of South Africa","1409347","","Independent Communications Authority of South Africa","1150770","","Independent Communication Authority of South Africa","1123189","","Independent Communication Authority of South Africa","1107013","","Independent Communication Authority of South Africa","1250356","","Independent Communication Authority of South Africa"
"Fixed-broadband subscriptions","South Sudan","","","","","","","","","","","","","","","","","","","","","","","","","","","","","","","2","Mainly government offices. Preliminary.","Ministry of Telecommunications & Postal Services","4","Business. Preliminary.","Ministry of Telecommunications & Postal Services","17","NGOs and other businesses. Preliminary.","Ministry of Telecommunications & Postal Services","100","","ITU estimate.","100","","Ministry of Telecommunications & Postal Services","150","","ITU estimate.","150","Zain only.","National Communication Authority; NCA","200","","National Communication Authority; NCA","200","","National Communication Authority; NCA","200","","National Communication Authority; NCA"
"Fixed-broadband subscriptions","Spain","76358","","Telefónica de España; S.A. Ministerio de Ciencia y Technología.","466600","","Telefónica de España; S.A. Ministerio de Ciencia y Technología.","1247496","","Comisión del Mercado de las Telecomunicaciones (CMT).","2121930","","Comisión del Mercado de las Telecomunicaciones (CMT).","3401411","","Comisión del Mercado de las Telecomunicaciones (CMT).","5035203","","Comisión del Mercado de las Telecomunicaciones (CMT).","6739110","","Comisión del Mercado de las Telecomunicaciones (CMT).","8055780","","Comisión del Mercado de las Telecomunicaciones","9135959","","Comisión del Mercado de las Telecomunicaciones","9800597","","Comisión del Mercado de las Telecomunicaciones","10652372","","Comisión del Mercado de las Telecomunicaciones","11167809","","Comisión del Mercado de las Telecomunicaciones","11524543","","Comisión del Mercado de las Telecomunicaciones","12252061","","Comisión Nacional de los Mercados y la Competencia","13004969","","Comisión Nacional de los Mercados y la Competencia","13542906","","Comisión Nacional de los Mercados y la Competencia","14112657","","Comisión Nacional de los Mercados y la Competencia","14668212","","Comisión Nacional de los Mercados y la Competencia","15176954","","Comisión Nacional de los Mercados y la Competencia","15616585","","Comisión Nacional de los Mercados y la Competencia"
"Fixed-broadband subscriptions","Sri Lanka","","","","327","","Telecommunications Regulatory Commission of Sri Lanka.","592","","Telecommunications Regulatory Commission of Sri Lanka.","3417","","Telecommunications Regulatory Commission of Sri Lanka.","20450","","Telecommunications Regulatory Commission of Sri Lanka.","21000","","ITU estimate.","22895","","Telecommunications Regulatory Commission of Sri Lanka.","63263","","Telecommunications Regulatory Commission of Sri Lanka.","101922","","Telecommunications Regulatory Commission of Sri Lanka.","169600","","Telecommunications Regulatory Commission of Sri Lanka.","228316","","Telecommunications Regulatory Commission of Sri Lanka","359000","Provisional.","Telecommunications Regulatory Commission of Sri Lanka","354000","","ITU estimate.","424357","","Telecommunications Regulatory Commission of Sri Lanka","567601","","Telecommunications Regulatory Commission of Sri Lanka","625917","","Telecommunications Regulatory Commission of Sri Lanka","892184","","Telecommunications Regulatory Commission of Sri Lanka","1220504","Telecommunications Regulatory Commission of Sri Lanka","Telecommunications Regulatory Commission of Sri Lanka","1544313","","Telecommunications Regulatory Commission of Sri Lanka","1666317","","Telecommunications Regulatory Commission of Sri Lanka"
"Fixed-broadband subscriptions","St. Helena","","","","","","","","","","3","","","12","","","15","","","16","","","20","","Cable & Wireless South Atlantic Ltd.","224","","Cable & Wireless South Atlantic Ltd.","415","","Cable & Wireless South Atlantic Ltd.","537","","Cable & Wireless South Atlantic Ltd.","799","","Cable & Wireless South Atlantic Ltd.","282","","Sure South Atlantic Ltd.","1107","","Sure South Atlantic Ltd.","1245","","Sure South Atlantic Ltd.","1337","","Sure South Atlantic Ltd.","1347","","Sure South Atlantic Ltd.","1000","","ITU estimate.","","","","","",""
"Fixed-broadband subscriptions","St. Maarten","","","","","","","","","","","","","","","","","","","","","","","","","","","","","","","","","","","","","","","","","","","","","","","","","","","","","","","","","","","",""
"Fixed-broadband subscriptions","St. Pierre & Miquelon","","","","","","","","","","","","","","","","","","","","","","","","","","","","","","","","","","","","","","","","","","","","","","","","","","","","","","","","","","","",""
"Fixed-broadband subscriptions","Sudan","","","","","","","","","","","","","793","","","1269","","","2065","","","42500","","National Telecommunication Corporation (NTC).","44625","","National Telecommunication Corporation (NTC).","","","","13500","","National Telecommunication Corporation (NTC)","17430","","National Telecommunication Corporation (NTC)","24789","","National Telecommunication Corporation (NTC)","25707","","National Telecommunication Corporation (NTC)","20661","","National Telecommunication Corporation (NTC)","28093","","National Telecommunication Corporation (NTC)","26376","","Telecommunication and Post Regulatory Authority","30549","","Telecommunication and Post Regulatory Authority","31352","","Telecommunication and Post Regulatory Authority","32762","","Telecommunication and Post Regulatory Authority"
"Fixed-broadband subscriptions","Suriname","","","","","","","94","","","216","","","420","","","1107","","","2656","","","4205","","ITU estimate.","5756","","ITU estimate.","9069","","Telecommunications Authority Suriname.","15143","","Telecommunications Authority Suriname (TAS)","23160","Preliminary.","Telecommunications Authority Suriname (TAS)","29268","","Telecommunications Authority Suriname (TAS)","37095","","","46400","","ITU estimate.","52691","","Telecommunications Authority Suriname (TAS)","71217","","Telecommunication Authority Suriname","71217","","Telecommunication Authority Suriname","73176","","Telecommunication Authority Suriname","80320","","Telecommunication Authority Suriname"
"Fixed-broadband subscriptions","Sweden","249000","","Swedish Institute for Transport and Communications Analysis.","587000","","Swedish Institute for Transport and Communications Analysis.","840000","","ITU estimate.","1095000","","Swedish Institute for Transport and Communications Analysis.","1410000","","Swedish Institute for Transport and Communications Analysis.","2522000","","Swedish Institute for Transport and Communications Analysis.","2489000","","Swedish Post and Telecom Agency (PTS).","2780298","","Swedish Post and Telecom Agency (PTS).","2902833","","Swedish Post and Telecom Agency (PTS).","2945093","","Swedish Post and Telecom Agency (PTS).","2999537","","Swedish Post and Telecom Authority","3027459","","Swedish Post and Telecom Authority","3073174","","Swedish Post and Telecom Authority","3147615","","Swedish Post and Telecom Authority","3281408","","Swedish Post and Telecom Authority","3496240","","Swedish Post and Telecom Authority","3679768","","Swedish Post and Telecom Authority","3854837","","Swedish Post and Telecom Authority (PTS)","3942088","","Swedish Post and Telecom Authority (PTS)","4038725","","Swedish Post and Telecom Authority (PTS)"
"Fixed-broadband subscriptions","Switzerland","56416","","OFCOM.","140000","","OFCOM.","455220","","OFCOM.","783874","","OFCOM.","1227397","","OFCOM.","1669217","","OFCOM.","2050184","","OFCOM.","2380588","","OFCOM.","2556297","","OFCOM.","2741199","","Office Fédéral de la Communication","2913517","","","3078338","","Office Fédéral de la Communication","3212371","","Office Fédéral de la Communication","3438094","","Office Fédéral de la Communication","3535986","Estimates.","Office Fédéral de la Communication","3700563","Estimates.","Office Fédéral de la Communication","3775916","","OFCOM","3916720","Telecommunications statistics 2017","Office Fédéral de la Communication","3883878","Telecommunications statistics 2018","Office Fédéral de la Communication","4029445","Telecommunications statistics 2019 / provisory results","Office Fédéral de la Communication"
"Fixed-broadband subscriptions","Syrian Arab Republic","","","","","","","","","","","","","600","","Syrian Telecommunications Establishment (STE).","2700","","ITU estimate.","5218","","Syrian Telecommunications Establishment (STE).","6957","","Syrian Telecommunications Establishment (STE).","11055","","Syrian Telecommunications Establishment (STE).","34657","","Syrian Telecommunication Establishment","69817","","Syrian Telecommunication Establishment","121300","","","242154","","","346146","","Syrian Telecommunication Regulatory Authority","501194","","Syrian Telecommunication Regulatory Authority","729261","","Syrian Telecommunication Regulatory Authority","1009614","","SyTRA","1423070","","SYTPRA","1328688","","SYTPRA","1490344","","SYTPRA"
"Fixed-broadband subscriptions","Taiwan, Province of China","229000","","","1133000","","","2100000","","","3043273","","","3751214","","","4340889","","","4505800","","","4790191","","National Communications Commission","5024378","","National Communications Commission","4997719","","National Communications Commission","5311603","","National Communications Commission","5515932","","National Communications Commission","6448823","","National Communications Commission","7011934","","National Communications Commission","7436620","","National Communications Commission","5656330","","National Communications Commission","5686003","","National Communications Commission","5713568","","National Communications Commission","5725022","","National Communications Commission","5831467","","National Communications Commission"
"Fixed-broadband subscriptions","Tajikistan","","","","","","","","","","10","","Tajiktelecom.","","","","","","","","","","3645","","Tajiktelecom.","3658","","ITU estimate.","4400","","ITU estimate.","4700","","ITU estimate.","5020","","ITU estimate.","5400","","ITU estimate.","5800","","ITU estimate.","6100","","ITU estimate.","6000","","ITU estimate.","6000","","ITU estimate.","6000","","ITU estimate.","","","","","",""
"Fixed-broadband subscriptions","Tanzania","","","","","","","","","","","","","","","","2589","","TCRA.","2998","","TCRA.","3394","","TCRA.","6422","","TCRA.","6947","","TCRA.","7554","","Tanzania Communications Regulatory Authority (TCRA)","28268","","Tanzania Communications Regulatory Authority (TCRA)","41325","","Tanzania Communications Regulatory Authority (TCRA)","56425","","Tanzania Communications Regulatory Authority (TCRA)","84600","","ITU estimate.","106000","","ITU estimate.","318474","","Tanzania Communications Regulatory Authority (TCRA)","763466","","Tanzania Communications Regulatory Authority (TCRA)","861234","","Tanzania Communications Regulatory Authority (TCRA)","1039655","","Tanzania Communications Regulatory Authority (TCRA)"
"Fixed-broadband subscriptions","Thailand","","","","1613","","Post and Telegraph Department (PTD).","","","","11611","","Ministry of Information and Communication Authority (MICT).","164775","","ITU research based on NBTC website.","555495","","ITU research based on NBTC website.","893548","","ITU research based on NBTC website.","1293341","","ITU research based on NBTC website.","2072799","","ITU research based on NBTC website.","2624278","","ITU research based on NBTC website.","3251851","","Ministry of Information and Communication Technology","3895000","","Ministry of Information and Communication Technology","4519000","","Ministry of Information and Communication Technology","5192000","","Ministry of Information and Communication Technology","5440000","","Ministry of Information and Communication Technology","6229000","NBTC","Ministry of Information and Communication Technology","7219000","NBTC","The National Broadcasting and Telecommunications Commission","8208000","NBTC","Office of the National Broadcasting and Telecommunications Commission","9189000","NBTC","Office of the National Broadcasting and Telecommunications Commission","10108819","NBTC","Office of the National Broadcasting and Telecommunications Commission"
"Fixed-broadband subscriptions","Timor-Leste","","","","","","","","","","9","","","13","","","22","","","29","","","50","","","71","","","471","","","500","","ITU estimate.","550","","ITU estimate.","600","","ITU estimate.","700","","ITU estimate.","1028","","National Communications Authority","1028","","National Communications Authority","662","","Autoridade Nacional de Comunicações","656","","Autoridade Nacional de Comunicações","603","","Autoridade Nacional de Comunicações","600","Estimate","Autoridade Nacional de Comunicações"
