"Indicator","Country","2000_value","2000_notes","2000_source","2001_value","2001_notes","2001_source","2002_value","2002_notes","2002_source","2003_value","2003_notes","2003_source","2004_value","2004_notes","2004_source","2005_value","2005_notes","2005_source","2006_value","2006_notes","2006_source","2007_value","2007_notes","2007_source","2008_value","2008_notes","2008_source","2009_value","2009_notes","2009_source","2010_value","2010_notes","2010_source","2011_value","2011_notes","2011_source","2012_value","2012_notes","2012_source","2013_value","2013_notes","2013_source","2014_value","2014_notes","2014_source","2015_value","2015_notes","2015_source","2016_value","2016_notes","2016_source","2017_value","2017_notes","2017_source","2018_value","2018_notes","2018_source","2019_value","2019_notes","2019_source"
"Fixed-broadband subscriptions","Costa Rica","","","","","","","8989","","","14878","","","27931","","","44914","","","83327","","","95000","","ICE-Telecomunicaciones","109939","","Instituto Costarricense de Electricidad (ICE).","182654","","ICE-Telecomunicaciones","396262","","Superintendencia de Telecomunicaciones","419782","","Superintendencia de Telecomunicaciones","448594","","Superintendencia de Telecomunicaciones","484883","","Superintendencia de Telecomunicaciones","516337","","Superintendencia de Telecomunicaciones","558656","","Superintendencia de Telecomunicaciones","639087","","Superintendencia de Telecomunicaciones","744041","","Superintendencia de Telecomunicaciones","834784","","Superintendencia de Telecomunicaciones","904734","Preliminary","Superintendencia de Telecomunicaciones"
"Fixed-broadband subscriptions","Croatia","","","","","","","","","","3400","","Croatian Post and Electronic Communications Agency (HAKOM).","26200","","Croatian Post and Electronic Communications Agency (HAKOM).","116200","","Croatian Post and Electronic Communications Agency (HAKOM).","251800","","Croatian Post and Electronic Communications Agency (HAKOM).","387050","","Croatian Post and Electronic Communications Agency (HAKOM).","527989","","Croatian Post and Electronic Communications Agency (HAKOM).","717354","","Croatian Post and Electronic Communications Agency (HAKOM).","837862","","Croatian Post and Electronic Communications Agency (HAKOM)","892835","","Croatian Post and Electronic Communications Agency (HAKOM)","919222","","Croatian Post and Electronic Communications Agency (HAKOM)","954720","","Croatian Post and Electronic Communications Agency (HAKOM)","984485","","Croatian Regulatory Authority for Network Industries","986215","","Croatian Regulatory Authority for Network Industries","1043795","","HAKOM","1095881","","HAKOM","1128273","","HAKOM","1154773","","HAKOM"
"Fixed-broadband subscriptions","Cuba","","","","","","","","","","","","","","","","","","","","","","1946","","ITU estimate.","2246","","Ministerio de la Informática y las Comunicaciones","2883","","Ministerio de la Informática y las Comunicaciones","3706","","Ministerio de la Informática y las Comunicaciones","4421","","Ministerio de la Informática y las Comunicaciones","5013","","Ministerio de la Informática y las Comunicaciones","5360","","Ministerio de Comunicaciones","7793","","Ministerio de Comunicaciones","8157","","Ministerio de Comunicaciones","14428","","Ministerio de Comunicaciones","33536","","Ministerio de Comunicaciones","98838","","Ministerio de Comunicaciones","182732","","Ministerio de Comunicaciones"
"Fixed-broadband subscriptions","Curacao","","","","","","","","","","","","","","","","","","","","","","","","","","","","","","","","","","31800","","Bureau Telecommunicatie & Post Curacao","35582","","Bureau Telecommunicatie & Post Curacao","37000","Estimate.","Bureau Telecommunicatie & Post Curacao","38663","","Bureau Telecommunicatie & Post Curacao","40000","Estimate","Bureau Telecommunicatie & Post Curacao","42713","","Bureau Telecommunicatie en Post","49348","","Bureau Telecommunicatie en Post","51836","","Bureau Telecommunicatie en Post","53297","","Bureau Telecommunicatie en Post"
"Fixed-broadband subscriptions","Cyprus","","","","2500","","Cyprus Telecommunications Authority (CYTA).","5879","","Cyprus Telecommunications Authority (CYTA).","10033","","Cyprus Telecommunications Authority (CYTA).","17070","","Cyprus Telecommunications Authority (CYTA).","31856","","Cyprus Telecommunications Authority (CYTA).","63084","","Cyprus Telecommunications Authority (CYTA).","97613","","Office of the Commissioner for Electronic Communications and Postal Regulation.","147276","","Office of the Commissioner for Electronic Communications and Postal Regulation.","176024","","Office of the Commissioner for Electronic Communications and Postal Regulation.","194455","","Office of the Commissioner for Electronic Communications and Postal Regulation","212149","","Office of the Commissioner for Electronic Communications and Postal Regulation","220580","","Office of the Commissioner for Electronic Communications and Postal Regulation","229195","","Office of the Commissioner for Electronic Communications and Postal Regulation","243611","","Office of the Commissioner for Electronic Communications and Postal Regulation","260640","","Office of the Commissioner for Electronic Communications and Postal Regulation","278483","","Office of the Commissioner for Electronic Communications and Postal Regulation","295686","","Office of the Commissioner for Electronic Communications and Postal Regulation","313462","","Office of the Commissioner for Electronic Communications and Postal Regulation","326565","","Office of the Commissioner for Electronic Communications and Postal Regulation"
"Fixed-broadband subscriptions","Czech Republic","2500","","Ministry of Economy. Czech Telecommunication Office.","6200","","Ministry of Economy. Czech Telecommunication Office.","15300","","Ministry of Economy. Czech Telecommunication Office.","34690","","Ministry of Economy. Czech Telecommunication Office.","235996","Broadband Internet subscriptions via DSL; CATV; FWA and other technologies are included.","Ministry of Economy. Czech Telecommunication Office.","709063","","Market analysis.","1112500","","Ministry of Economy. Czech Telecommunication Office.","1496720","Break in comparability: from this year excluding fixed wireless broadband.","ITU estimate.","1759586","","ITU estimate.","2036110","","Czech Telecommunication Office","2261179","","Czech Telecommunication Office","2509100","","Czech Telecommunication Office","2656980","","Czech Telecommunication Office","2856168","","Czech Telecommunication Office","2994818","Incl. WiFi subscriptions (not WiFi hotspots).","Czech Telecommunication Office","2946626","Incl. WiFi subscriptions (not WiFi hotspots). Estimate.","Czech Telecommunication Office","3069970","Incl. WiFi subscriptions (not WiFi hotspots).","Czech Telecommunication Office","3146091","Incl. WIFI subscriptions (not WIFI hotspots).","Czech Telecommunication Office","3222835","Incl. WIFI subscriptions (not WIFI hotspots).","Czech Telecommunication Office","3739614","The number of fixed wireless subscriptions provided via specific services (tariffs) with limited mobility and enabling the provision of Internet access service at a fixed location via LTE network were newly included (together with other types of fixed access in this category) under this indicator.","Czech Telecommunication Office"
"Fixed-broadband subscriptions","Côte d'Ivoire","","","","","","","","","","413","","ITU estimate.","826","","Agence des Télécommunications de Côte d'Ivoire.","1239","","ITU estimate.","10000","","Agence des Télécommunications de Côte d'Ivoire.","10000","","Agence des Télécommunications de Côte d'Ivoire (ATCI).","10000","","Agence des Télécommunications de Côte d'Ivoire (ATCI).","10000","","ITU estimate.","","","","","","","46167","","Autorité de Régulation des Télécommunications/TIC","56281","","Autorité de Régulation des Télécommunications/TIC","126857","","Autorité de Régulation des Télécommunications/TIC","109707","","Autorité de Régulation des Télécommunications/TIC","136380","","ARTCI","142825","","ARTCI","175918","","ARTCI","216723","","ARTCI"
"Fixed-broadband subscriptions","Dem. People's Rep. of Korea","","","","","","","","","","","","","","","","","","","","","","","","","","","","","","","","","","","","","","","","","","","","","","","","","","","","","","","","","","","",""
"Fixed-broadband subscriptions","Dem. Rep. of the Congo","","","","","","","","","","","","","","","","","","","","","","","","","","","","","","","0","","ITU estimate.","","","","","","","450","","ITU estimate.","500","","ITU estimate.","1000","","ITU estimate.","1000","","Autorité de Régulation de la Poste et des Télécommunications","1000","","ARPTC","4620","","ARPTC","11900","","ARPTC"
"Fixed-broadband subscriptions","Denmark","67000","","National IT and Telecom Agency.","238000","","National IT and Telecom Agency.","451297","","National IT and Telecom Agency.","718299","","National IT and Telecom Agency.","1017594","","National IT and Telecom Agency.","1343855","","National IT and Telecom Agency.","1735317","","OECD.","1903541","","National IT and Telecommunications Agency Denmark","2005681","","National IT- and Telecom Agency NITA","2022709","","National IT- and Telecom Agency NITA","2112406","","Danish Business Authority","2143247","","Danish Business Authority","2179545","","Danish Business Authority","2272401","Incl. 144 kbit/s to less than 256 kbit/s. Excl. subscriptions with unspecified download capacity.","Danish Energy Agency","2341759","Incl. 144 kbit/s to less than 256 kbit/s. Incl. subscriptions with unspecified download capacity.","Danish Energy Agency","2404962","Incl. 144 kbit/s to less than 256 kbit/s. Incl. subscriptions with unspecified download capacity.","Danish Energy Agency","2461403","","Center for Tele","2511871","","Danish Energy Agency","2535904","","Danish Energy Agency","2536508","","Danish Energy Agency"
"Fixed-broadband subscriptions","Djibouti","4","","","5","","","6","","","","","","","","","42","","","152","Includes ADSL connections at 128kbps.","ITU estimate.","1092","Includes ADSL connections at 128kbps.","Ministère de la Communication et de la Culture; chargé des Postes et des Télécommunications.","2451","Includes ADSL connections at 128kbps.","Ministère de la Communication et de la Culture; chargé des Postes et des Télécommunications.","5285","Includes ADSL connections at 128kbps.","Ministère de la Communication et de la Culture; chargé des Postes et des Télécommunications.","8058","Includes ADSL connections at 128kbps.","Ministère de la Communication et de la Culture; chargé des Postes et des Télécommunications","11302","","Ministère de la Communication et de la Culture chargé des Postes et des Télécommunications","14907","","Ministère de la Communication et de la Culture chargé des Postes et des Télécommunications","17705","","Ministère de la Communication et de la Culture chargé des Postes et des Télécommunications","20102","","Ministère de la Communication et de la Culture chargé des Postes et des Télécommunications","24165","","Ministère de la Communication chargé des Postes et des Télécommunications","24275","","Ministère de la Communication chargé des Postes et des Télécommunications","24389","","Ministère de la Communication chargé des Postes et des Télécommunications","25508","","Ministère de la Communication chargé des Postes et des Télécommunications","24416","","Ministère de la Communication chargé des Postes et des Télécommunications"
"Fixed-broadband subscriptions","Dominica","80","","","175","","","2238","","","2651","","","3253","","","3400","","","4300","","ECTEL.","5000","","ECTEL.","7000","","ECTEL.","7300","","ECTEL.","8311","","National Telecommunications Regulatory Commission","8307","","National Telecommunications Regulatory Commission","8500","","National Telecommunications Regulatory Commission","10667","","National Telecommunications Regulatory Commission","10785","","ECTEL","15159","","ECTEL","15487","","National Telecommunications Regulatory Commission","15423","","National Telecommunications Regulatory Commission","11514","Flow is 3;539 subscribers and Digicel (in 2017) 7975 subscribers","National Telecommunications Regulatory Commission","","",""
"Fixed-broadband subscriptions","Dominican Rep.","","","","","","","","","","15000","","","37257","","","60674","","","102880","","","173752","","INDOTEL","239118","","Instituto Dominicano de las Telecomunicaciones (INDOTEL)","315593","","Instituto Dominicano de las Telecomunicaciones (INDOTEL)","390505","","Instituto Dominicano de las Telecomunicaciones (INDOTEL)","423919","","Instituto Dominicano de las Telecomunicaciones (INDOTEL)","483625","","Instituto Dominicano de las Telecomunicaciones (INDOTEL)","526705","","Instituto Dominicano de las Telecomunicaciones (INDOTEL)","599996","","Instituto Dominicano de las Telecomunicaciones (INDOTEL)","686107","","Instituto Dominicano de las Telecomunicaciones (INDOTEL)","761255","","INSTITUTO DOMINICANO DE LAS TELECOMUNICACIONES","820578","Revised data due to reports actualization","INSTITUTO DOMINICANO DE LAS TELECOMUNICACIONES","878031","","INSTITUTO DOMINICANO DE LAS TELECOMUNICACIONES","951970","","INSTITUTO DOMINICANO DE LAS TELECOMUNICACIONES"
"Fixed-broadband subscriptions","Ecuador","","","","2623","","","6499","","","6916","","","11620","","","26786","","","46000","","ITU estimate.","100000","","ITU estimate.","155998","All speeds considered.","SENATEL.","241233","All speeds considered.","SENATEL.","221320","Break in comparability: as of 2010 >=256 kbits/s.","Secretaría Nacional de Telecomunicaciones (SENATEL)","658923","","Secretaría Nacional de Telecomunicaciones (SENATEL)","843704","","ITU estimate.","1058453","","Secretaría Nacional de Telecomunicaciones (SENATEL)","1319627","Estimate.","Agencia de Regulación y Control de las Telecomunicaciones","1487592","Incl. speeds below 256 kbit/s.","Agencia de Regulación y Control de las Telecomunicaciones","1609586","from this year; incl. only speeds at 256 kbit/s or above.","Agencia de Regulación y Control de las Telecomunicaciones","1778607","","Agencia de Regulación y Control de las Telecomunicaciones","1953607","","Agencia de Regulación y Control de las Telecomunicaciones","2092458","","Agencia de Regulación y Control de las Telecomunicaciones"
"Fixed-broadband subscriptions","Egypt","","","","","","","50937","","MCIT.","54850","","MCIT.","79217","","MCIT.","140999","","MCIT.","258526","","MCIT.","477432","","Ministry of Communications and Information Technology.","769744","","Ministry of Communications and Information Technology.","1077489","","Ministry of Communications and Information Technology","1451628","","Ministry of Communications and Information Technology","1845249","","Ministry of Communications and Information Technology","2288773","","Ministry of Communications and Information Technology","2676263","","Ministry of Communications and Information Technology","3067878","","Ministry of Communications and Information Technology","3826410","","Ministry of Communications and Information Technology","4469164","","Ministry of Communications and Information Technology","5233872","","Ministry of Communications and Information Technology","6624421","","Ministry of Communications and Information Technology","7598941","","Ministry of Communications and Information Technology"
"Fixed-broadband subscriptions","El Salvador","","","","","","","","","","19601","","","29321","","","42314","Incl. a small part of ISDN (i.e. narrowband).","Superintendencia General de Electricidad y Telecomunicaciones","61484","Incl. a small part of ISDN (i.e. narrowband).","Superintendencia General de Electricidad y Telecomunicaciones","89761","Incl. a small part of ISDN (i.e. narrowband).","Superintendencia General de Electricidad y Telecomunicaciones","123469","Incl. a small part of ISDN (i.e. narrowband).","Superintendencia General de Electricidad y Telecomunicaciones","149406","Incl. a small part of ISDN (i.e. narrowband).","Superintendencia General de Electricidad y Telecomunicaciones","175274","Estimate based on June 2010 data. Incl. a small part of ISDN (i.e. narrowband).","Superintendencia General de Electricidad y Telecomunicaciones","206000","","ITU estimate.","242100","","ITU estimate.","284428","","Superintendencia General de Electricidad y Telecomunicaciones","318915","","Superintendencia General de Electricidad y Telecomunicaciones","353001","","Superintendencia General de Electricidad y Telecomunicaciones","395307","","Superintendencia General de Electricidad y Telecomunicaciones","451263","","Superintendencia General de Electricidad y Telecomunicaciones","492265","","Superintendencia General de Electricidad y Telecomunicaciones","","",""
"Fixed-broadband subscriptions","Equatorial Guinea","","","","","","","","","","","","","","","","180","","","180","","ITU estimate.","180","","ITU estimate.","180","","ITU estimate.","180","","ITU estimate.","1186","","La Société Anonyme de Télécommunications de la République de Guinée Equatoriale","1346","","La Société Anonyme de Télécommunications de la République de Guinée Equatoriale","1480","","La Société Anonyme de Télécommunications de la République de Guinée Equatoriale","3518","","Orange-GETESA","3881","","La Société Anonyme de Télécommunications de la République de Guinée Equatoriale","3799","","La Société Anonyme de Télécommunications de la République de Guinée Equatoriale","3382","getesa","La Société Anonyme de Télécommunications de la République de Guinée Equatoriale","1897","","La Société Anonyme de Télécommunications de la République de Guinée Equatoriale","1620","","La Société Anonyme de Télécommunications de la République de Guinée Equatoriale","","",""
"Fixed-broadband subscriptions","Eritrea","","","","","","","","","","","","","","","","","","","","","","","","","44","","EriTel","70","","EriTel","118","","EriTel","141","","EriTel","185","","EriTel","146","","EriTel","200","","ITU estimate.","500","","ITU estimate.","600","","ITU estimate.","1000","","ITU estimate.","","","","","",""
"Fixed-broadband subscriptions","Estonia","","","","17474","","ITU calculation.","46500","","ITU calculation.","90300","","","138677","","","179200","","","246800","","","264949","","Estonian Competition Authority.","294660","","Estonian Competition Authority. Estonian Competition Auhtority.","313625","","Estonian Competition Auhtority.","347883","","Estonian Competition Authority","348946","","Estonian Competition Authority","349507","","Estonian Competition Authority","360948","","Estonian Competition Authority","371009","","Estonian Technical Regulation Authority","390275","","Estonian Technical Regulatory Authority","414478","Speed information is provided by the line basis","Consumer Protection and Technical Regulatory Authority","428453","Speed information is provided by the line basis","Consumer Protection and Technical Regulatory Authority","441173","","Consumer Protection and Technical Regulatory Authority","431251","Information is provided by the line basis","Consumer Protection and Technical Regulatory Authority"
"Fixed-broadband subscriptions","Eswatini","","","","","","","","","","","","","","","","","","","","","","","","","772","","Swaziland Posts and Telecommunications Corporation (STPC).","1504","","Swaziland Posts and Telecommunications Corporation","3658","","Swaziland Posts and Telecommunications Corporation","8024","","Swaziland Posts and Telecommunications Corporation","3429","","Swaziland Posts and Telecommunications Corporation","4200","","ITU estimate.","5100","","ITU estimate.","6000","","ITU estimate.","7000","","ITU estimate.","8000","","ITU estimate.","","","","","",""
"Fixed-broadband subscriptions","Ethiopia","","","","","","","","","","57","","Ethiopian Telecommunications Corporation (ETC). Ethiopian Telecommunication Agency.","35","","ITU estimate.","61","","ITU estimate.","261","","Ethiopian Telecommunications Corporation (ETC). Ethiopian Telecommunication Agency.","1036","","Ethiopian Telecommunication Agency.","1496","","Ethiopian Telecommunication Agency.","3498","","Ethiopian Telecommunication Agency.","4107","","Ministry of Communication and InformationTechnology.","6353","","Ministry of Communications and Information Technology","8535","","Ministry of Communications and Information Technology","238067","","Ministry of Communications and Information Technology","471285","","Ministry of Communications and Information Technology","478000","","Ministry of Communications and Information Technology","559000","","Ministry of Communications and Information Technology","62950","Starting end of 2016; and in 2017 our country was under a state of emergency where internet shutdown was implemented this  has shown significant decrease.","Ministry of Communications and Information Technology","","","","","",""
"Fixed-broadband subscriptions","Falkland (Malvinas) Is.","","","","","","","","","","","","","","","","","","","319","","","618","","Cable & Wireless South Atlantic Plc","888","","Cable & Wireless","1140","","Cable & Wireless","1174","","Cable & Wireless","1209","","Cable & Wireless","1229","","Cable & Wireless","1296","","Sure","1413","","Sure","2000","","ITU estimate.","1610","","Sure","1000","","ITU estimate.","","","","","",""
"Fixed-broadband subscriptions","Faroe Islands","","","","54","","","114","","","394","","","3134","","","5868","","","13128","","ITU calculation.","14463","","Postal and Telecom Surveillance Authority.","14878","","Postal and Telecom Surveillance Authority.","15882","","Post and Telecom Surveillance Authority","16179","","Post and Telecom Surveillance Authority","16057","","Post and Telecom Surveillance Authority","16324","","Post and Telecom Surveillance Authority","16700","","ITU estimate.","17363","","Post and Telecom Authority","17792","","Post and Telecom Authority","17973","","Fjarskiftiseftirlitið (NRA)","18041","","Fjarskiftiseftirlitið (NRA)","18181","","Fjarskiftiseftirlitið (NRA)","","",""
"Fixed-broadband subscriptions","Fiji","","","","","","","","","","","","","","","","7000","","","8500","","","11500","","ITU estimate.","13031","","Ministry of Public Enterprises; Communications; Civil Aviation and Tourism","12830","","Ministry of Public Enterprises; Communications; Civil Aviation and Tourism","23250","","Ministry of Public Enterprises; Communications; Civil Aviation and Tourism","23250","","Ministry of Public Enterprises; Communications; Civil Aviation and Tourism","13516","","Ministry of Communications","10927","","Ministry of Communications","12427","","Ministry of Communications","12734","","Ministry of Communications","12332","","Ministry of Communications","12135","","Ministry of Communications","13033","","Ministry of Communications","","",""
"Fixed-broadband subscriptions","Finland","35000","","Ministry of Transport and Communications.","134000","","Ministry of Transport and Communications.","273500","","Ministry of Transport and Communications.","491100","","Ministry of Transport and Communications.","800000","","Ministry of Transport and Communications.","1174200","","Finnish Communications Regulatory Authority.","1429000","","OECD.","1617000","","Finnish Communications Regulatory Authority.","1618000","From this year excl. FW.","Finnish Communications Regulatory Authority.","1565600","March 2011.","Finnish Communications Regulatory Authority (FICORA)","1559400","September 2012.","Finnish Communications Regulatory Authority (FICORA)","1606000","","Finnish Communications Regulatory Authority (FICORA)","1647600","","Finnish Communications Regulatory Authority (FICORA)","1720200","","Finnish Communications Regulatory Authority (FICORA)","1758500","","Finnish Communications Regulatory Authority (FICORA)","1729897","","Finnish Communications Regulatory Authority (FICORA)","1712000","","Finnish Transport and Communications Agency Traficom","1710000","","Finnish Transport and Communications Agency Traficom","1737000","","Finnish Transport and Communications Agency Traficom","1797000","","Finnish Transport and Communications Agency Traficom"
"Fixed-broadband subscriptions","France","196601","","Autorité de Régulation des Communications Electroniques et des Postes (ARCEP).","601500","","Autorité de Régulation des Communications Electroniques et des Postes (ARCEP).","1655000","","Autorité de Régulation des Communications Electroniques et des Postes (ARCEP).","3569381","","Autorité de Régulation des Communications Electroniques et des Postes (ARCEP).","6561035","","Autorité de Régulation des Communications Electroniques et des Postes (ARCEP).","9471000","","Autorité de Régulation des Communications Electroniques et des Postes (ARCEP).","12711000","","Autorité de Régulation des Communications Electroniques et des Postes (ARCEP).","15750000","","ARCEP","17830000","512kbps or higher.","ARCEP","19852000","","Autorité de Régulation des Communications électroniques et des postes","21337000","","Autorité de Régulation des Communications électroniques et des postes","22749000","","Autorité de Régulation des Communications électroniques et des postes","23980000","","Autorité de Régulation des Communications électroniques et des postes","24940000","","Autorité de Régulation des Communications électroniques et des postes","25969000","","Autorité de Régulation des Communications électroniques et des postes","26867000","","Autorité de Régulation des Communications électroniques et des postes","27680000","","ARCEP","28480000","","ARCEP","29100000","","ARCEP","29760000","","ARCEP"
