"Indicator","Country","2000_value","2000_notes","2000_source","2001_value","2001_notes","2001_source","2002_value","2002_notes","2002_source","2003_value","2003_notes","2003_source","2004_value","2004_notes","2004_source","2005_value","2005_notes","2005_source","2006_value","2006_notes","2006_source","2007_value","2007_notes","2007_source","2008_value","2008_notes","2008_source","2009_value","2009_notes","2009_source","2010_value","2010_notes","2010_source","2011_value","2011_notes","2011_source","2012_value","2012_notes","2012_source","2013_value","2013_notes","2013_source","2014_value","2014_notes","2014_source","2015_value","2015_notes","2015_source","2016_value","2016_notes","2016_source","2017_value","2017_notes","2017_source","2018_value","2018_notes","2018_source","2019_value","2019_notes","2019_source"
"Fixed-broadband subscriptions","Italy","115000","","Telecom Italia. Ministry of Communications.","390000","","Telecom Italia. Ministry of Communications.","850000","","Telecom Italia. Ministry of Communications.","2250000","","Telecom Italia. Ministry of Communications.","4724500","","Telecom Italia. Ministry of Communications.","6822210","","Telecom Italia. Ministry of Communications.","8497422","","Ministry of Economic Development","10122126","","Ministry of Economic Development","11276262","","Ministry of ECONOMIC DEVELOPMENT - dep. of Communications","12084537","","Ministry of ECONOMIC DEVELOPMENT - dep. of Communications","13098028","","Ministry of ECONOMIC DEVELOPMENT - dep. of Communications","13518710","Source: Agcom Quaterly Observatory/CoCom.","Ministry of ECONOMIC DEVELOPMENT - dep. of Communications","13763362","Source: Agcom Observatory/CoCom.","Ministry of ECONOMIC DEVELOPMENT - dep. of Communications","14012976","Source: Quarterly Observatory","Ministry of ECONOMIC DEVELOPMENT - dep. of Communications","14382487","Source: AGCOM","AGCOM","14900171","Source: AGCOM","Ministry of Economic Development","15563279","Source: AGCOM","AGCOM","16586376","Source: AGCOM","AGCOM","17060505","Source: AGCOM","AGCOM","17470489","Source: AGCOM","AGCOM"
"Fixed-broadband subscriptions","Jamaica","","","","3235","","ITU estimate.","9000","","Office of Utilities Regulation.","9000","","Office of Utilities Regulation.","27000","","ITU estimate.","45000","","Office of Utilities Regulation.","68243","","Office of Utilities Regulation.","92768","","Office of Utilities Regulation.","97323","","Office of Utilities Regulation","112201","","Office of Utilities Regulation","116685","","Office of Utilities Regulation","118269","","Office of Utilities Regulation","123046","","Office of Utilities Regulation","140816","","Office of Utilities Regulation","151554","","Office of Utilities Regulation","228890","","Office of Utilities Regulation","286068","","Office of Utilities Regulation","239120","","Office of Utilities Regulation","284756","","Office of Utilities Regulation","317907","","Office of Utilities Regulation"
"Fixed-broadband subscriptions","Japan","854655","","Ministry of Internal Affairs and Communications (MIC); Telecommunications Carriers Associations (TCA).","3835000","","Ministry of Internal Affairs and Communications (MIC); Telecommunications Carriers Associations (TCA).","9397426","","Ministry of Internal Affairs and Communications (MIC); Telecommunications Carriers Associations (TCA).","14917165","","Ministry of Internal Affairs and Communications (MIC); Telecommunications Carriers Associations (TCA).","19557146","","Ministry of Internal Affairs and Communications (MIC); Telecommunications Carriers Associations (TCA).","23301105","Dec.","Ministry of Internal Affairs and Communications (MIC); Telecommunications Carriers Associations (TCA).","26438867","Dec.","Ministry of Internal Affairs and Communications (MIC); Telecommunications Carriers Associations (TCA).","28303003","Dec.","Ministry of Internal Affairs and Communications(MIC)","30117679","Dec.","Ministry of Internal Affairs and Communications","32863203","","Ministry of Internal Affairs and Communications","34101778","","Ministry of Internal Affairs and Communications","35696214","","Ministry of Internal Affairs and Communications","36132405","","Ministry of Internal Affairs and Communications","36918650","","Ministry of Internal Affairs and Communications","37788929","","Ministry of Internal Affairs and Communications","38872579","Total does not equa the sum of subscriptions by speed since it included subscriptions with unknown speed.","Ministry of Internal Affairs and Communications","39805586","Total does not equal the sum of subscriptions by speed since it included subscriptions with unknown speed.","Ministry of Internal Affairs and Communications","40532466","Total does not equal the sum of subscriptions by speed since it included subscriptions with unknown speed.","Ministry of Internal Affairs and Communications","41496293","Total does not equal the sum of subscriptions by speed since it included subscriptions with unknown speed.","Ministry of Internal Affairs and Communications","42502489","Total does not equal the sum of subscriptions by speed since it included subscriptions with unknown speed.","Ministry of Internal Affairs and Communications"
"Fixed-broadband subscriptions","Jersey","","","","","","","","","","","","","","","","","","","","","","","","","","","","","","","","","","","","","","","","","","","","","","","","","","","","","","","","","","","",""
"Fixed-broadband subscriptions","Jordan","","","","409","","Telecommunications Regulatory Commission.","3177","","Telecommunications Regulatory Commission.","4996","","Telecommunications Regulatory Commission.","10424","","Telecommunications Regulatory Commission.","23551","","Telecommunications Regulatory Commission.","48622","","Telecommunications Regulatory Commission.","88818","","Telecommunications Regulatory Commission.","145838","","Telecommunications Regulatory Commission.","237996","","Telecommunications Regulatory Commission.","293276","","Telecommunications Regulatory Commission","296612","","Telecommunications Regulatory Commission","300294","","Telecommunications Regulatory Commission","328382","","Telecommunications Regulatory Commission","351783","","Telecommunications Regulatory Commission","309726","","Telecommunications Regulatory Commission","297324","","The Telecommunications Regulatory Commission of Jordan","331925","","The Telecommunications Regulatory Commission of Jordan","399596","","The Telecommunications Regulatory Commission of Jordan","457496","","The Telecommunications Regulatory Commission of Jordan"
"Fixed-broadband subscriptions","Kazakhstan","","","","","","","","","","998","","ITU estimate.","1997","","Ministry of Transport and Communications.","2996","","Ministry of Transport and Communications.","30500","","Ministry of Transport and Communications.","270370","","Ministry of Transport and Communications.","337300","","Ministry for Communications and Informations","577344","","Ministry of the Republic of Kazakhstan for Communications and Information","869600","","Ministry for Communications and Information of Republic of Kazakhstan","1193400","","Ministry of Transport and Communications of the Republic of Kazakhstan","1637300","","Ministry of Transport and Communications of the Republic of Kazakhstan","1958823","","The Committee for Communication; informatization and information of the Ministry for Investment and Development of the Republic of Kazakhstan","2148000","","The Committee for Communication; informatization and information of the Ministry for Investment and Development of the Republic of Kazakhstan","2301000","","Ministry of Information and Communication of the Republic of Kazakhstan","2349900","Incl. fixed wired and fixed wireless broadband subscriptions.","Ministry of Digital Development Innovation and Aerospace","2576100","","Ministry of digital development; innovation and aerospace industry of the Republic of Kazakhstan","2461300","","Ministry of digital development; innovation and aerospace industry of the Republic of Kazakhstan","2511100","","Ministry of digital development; innovation and aerospace industry of the Republic of Kazakhstan"
"Fixed-broadband subscriptions","Kenya","","","","","","","","","","","","","","","","5399","","","17723","","","17737","","Communications Commission of Kenya (CCK).","3282","Decline was due to subscribers switching to wireless technologies.","Communications Commission of Kenya (CCK).","18200","","Communications Commission of Kenya (CCK).","6866","Decline was due to subscribers switching to wireless technologies.","Communications Commission of Kenya (CCK).","54144","Increased fibre connections during the period","Communications Commission of Kenya (CCK).","54348","","Communications Commission of Kenya","74144","","CCK.","101813","","Communications Authority  of Kenya","135107","","Communications Authority  of Kenya","132702","","COMMUNICATIONS AUTHORITY OF KENYA","288303","","COMMUNICATIONS AUTHORITY OF KENYA","371498","","COMMUNICATIONS AUTHORITY OF KENYA","491183","","COMMUNICATIONS AUTHORITY OF KENYA"
"Fixed-broadband subscriptions","Kiribati","","","","","","","","","","","","","","","","322","","Telecommunications Authority of Kiribati","402","","Telecommunications Authority of Kiribati","504","","Telecommunications Authority of Kiribati","685","","Telecommunications Authority of Kiribati","765","","Telecommunications Authority of Kiribati","846","","Telecommunications Authority of Kiribati","850","","ITU estimate.","800","","ITU estimate.","700","","ITU estimate.","500","","ITU estimate.","117","","Ministry of Information; Communication; Transport and Tourism Development","110","ipvpn","MICTTD","111","","Ministry of ICTTD","87","correct value consolidated","Ministry of ICTTD","105","include all ISPs","Ministry of ICTTD"
"Fixed-broadband subscriptions","Korea (Rep. of)","3870000","","Ministry of Information and Communication.","7818020","","Ministry of Information and Communication.","10405486","","KCC.","11178499","","Ministry of Information and Communication.","11921439","","Ministry of Information and Communication.","12190711","","Ministry of Information and Communication.","14042698","","OECD.","14709998","","Korea Communications Commission; Rep of Korea","15474931","","Korea Communications Commission","16348571","","Korea Communications Commission","17194272","","Korea Communications Commission","17859522","","Korea Communications Commission","18252661","","Ministry of Science; ICT and Future Planning","18737514","","Ministry of Science; ICT and Future Planning","19198934","","Ministry of Science; ICT and Future Planning","20024419","","Ministry of Science; ICT and Future Planning","20555683","","Ministry of Science and ICT","21195918","","Ministry of Science and ICT","21285858","","Ministry of Science and ICT","21906172","","Ministry of Science and ICT"
"Fixed-broadband subscriptions","Kosovo","","","","","","","","","","","","","","","","","","","","","","","","","","","","","","","","","","","","","","","","","","","","","","","","","","","","","","","","","","","",""
"Fixed-broadband subscriptions","Kuwait","","","","5000","","","10500","","","13000","","","20000","","","25000","","","30000","","ITU estimate.","35000","","ITU estimate.","40000","","ITU estimate.","45000","","ITU estimate.","46000","","ITU estimate.","47000","","ITU estimate.","47000","","ITU estimate.","47000","","ITU estimate.","48000","","Ministry of Communications","55000","","Communication and Information Technology Regulatory Authority","101390","","CITRA","117719","117680;as 10 Mbit and above is the total of i4213_10-30 +i4213_30-100+i4213_G100","CITRA","103821","","CITRA","84595","","CITRA"
"Fixed-broadband subscriptions","Kyrgyzstan","","","","","","","36","","","139","","","1907","","","2292","","","2762","","","3115","","National Communications Agency.","19032","","National Communications Agency.","17355","","State Communications Agency under the Governmet of the Kyrgyz Republic","23053","","State Communications Agency under the Governmet of the Kyrgyz Republic","39040","","State Communications Agency under the Governmet of the Kyrgyz Republic","54614","","State Communications Agency under the Governmet of the Kyrgyz Republic","136200","","State Communications Agency under the Governmet of the Kyrgyz Republic","170706","","State Communications Agency under the Governmet of the Kyrgyz Republic","211521","","State Communications Agency under the Governmet of the Kyrgyz Republic","240873","","State Communications Agency under the State Committee for IT and Communications of the Kyrgyz Republic","258013","","State Communications Agency under the State Committee for IT and Communications of the Kyrgyz Republic","250612","","State Communications Agency under the State Committee for IT and Communications of the Kyrgyz Republic","269091","","State Communications Agency under the State Committee for IT and Communications of the Kyrgyz Republic"
"Fixed-broadband subscriptions","Lao P.D.R.","","","","","","","","","","25","","ITU estimate.","50","","Lao Telecommunications Co.; Ltd.","314","","Lao Telecommunications Co.; Ltd.","741","","Ministère des communications; transports; postes et de la construction.","1135","","National Authority of Post and Telecommunication.","2896","","National Authority of Post and Telecommunication.","4317","","National Authority of Post and Telecommunication.","5885","Only ETL and LTC","Ministry of Posts and Telecommunications","6546","Only ETL and LTC","Ministry of Posts and Telecommunications","7578","Only ETL and LTC","ITU estimate.","9025","There are Ref.no from 4 main operators; LTC;BEELINE;UNITEL;ETL","ITU estimate.","16119","There are Ref.no from 4 main operators; LTC;BEELINE;UNITEL;ETL","Ministry of Post and Telecommunication","14550","There are Ref.no from 4 main operators; LTC;BEELINE;UNITEL;ETL","Ministry of Post and Telecommunication","24426","There are Ref.no from 4 main operators; LTC;BEELINE;UNITEL;ETL","Ministry of Post and Telecommunication","27217","There are Ref.no from 4 main operators; LTC;BEELINE;UNITEL;ETL","Ministry of Post and Telecommunication","45379","","Ministry of Post and Telecommunication","76280","Ministry of Post and Telecommunication","Ministry of Post and Telecommunication"
"Fixed-broadband subscriptions","Latvia","284","","Ministry of Transport.","3235","","Ministry of Transport.","10000","","Ministry of Transport.","19533","","Ministry of Transport.","49147","","Ministry of Transport.","60770","","Ministry of Transport.","109674","","Ministry of Transport.","338559","","Ministry of Transport.","412108","","Ministry of Transport","454714","","Ministry of Transport","434876","","Ministry of Transport","457422","","Ministry of Transport","476141","Source - Public Utilities Commission","Ministry of Transport","496000","Source - Public Utilities Commission","Ministry of Transport","505000","","Public Utilities Commission","503503","Source - Public Utilities Commission","Ministry of Transport; Department of Communications","519154","Source - Public Utilities Commission","Ministry of Transport of the Republic of Latvia","526222","Source - Public Utilities Commission","Ministry of Transport of the Republic of Latvia","525995","Source - Public Utilities Commission","Ministry of Transport of the Republic of Latvia","508894","Source - Public Utilities Commission","Ministry of Transport of the Republic of Latvia"
"Fixed-broadband subscriptions","Lebanon","","","","","","","0","","Ministry of Telecommunications","0","","Ministry of Telecommunications","0","","Ministry of Telecommunications","0","","Ministry of Telecommunications","0","","Ministry of Telecommunications","50000","","ITU estimate.","100000","","ITU estimate.","197000","","ITU estimate.","331089",".","Telecommunications Regulatory Authority","402329","","Telecommunications Regulatory Authority","476185","Source: MOT.","Telecommunications Regulatory Authority","480000","","Telecommunications Regulatory Authority","1132139","From this year incl. Internet cable subscriptions (596'663) that were not included before. In 2014; for the first time MOT issued licences to cable operators to allow them to offer Internet services.","Ogero/ MOT","","","","","","Ministère des Télécommunications","","","Ministere des Telecommunications","","","Ministere des Telecommunications","420000","","Ministere des Telecommunications"
"Fixed-broadband subscriptions","Lesotho","","","","","","","","","","","","","22","","ITU estimate.","45","","ITU estimate.","","","","110","","Lesotho Telecommunications Authority (LTA).","140","","Lesotho Telecommunications Authority (LTA).","400","","ITU estimate.","400","","ITU estimate.","1339","","","1636","","Lesotho Telecommunications Authority","2275","","Lesotho Communications Authority","1502","","Lesotho Communications Authority","2062","","Lesotho Communications Authority","2230","","LESOTHO COMMUNICATIONS AUTHORITY","4821","","Lesotho Communications Authority","5763","","Lesotho Communications Authority","6329","","Lesotho Communications Authority"
"Fixed-broadband subscriptions","Liberia","","","","","","","","","","","","","","","","","","","","","","","","","110","Data represents only one major service provider.","Liberia Telecommunications Authority","150","Data represents only one major service provider.","Liberia Telecommunications Authority","186","","Liberia Telecommunications Authority","63","Data represents three major service provider. Very limited fixed broadband","Liberia Telecommunications Authority","524","","","5080","","","6000","","ITU estimate","7000","","ITU estimate.","8000","","ITU estimate.","9000","","ITU estimate.","","","","","",""
"Fixed-broadband subscriptions","Libya","","","","","","","","","","","","","","","","","","","","","","","","","46242","","General Telecom Authority.","63000","","General Telecom Authority.","72800","","ITU estimate.","70000","","ITU estimate.","67300","","ITU estimate.","64700","","ITU estimate.","62800","","ITU estimate.","61000","","ITU estimate.","168920","","General Authority for Communications and informatics","318000","","ITU estimate.","","","","","",""
"Fixed-broadband subscriptions","Liechtenstein","","","","","","","1437","","","1500","","","4741","","","8617","","","10000","","","14200","Source: LIE yearly statistics report.","Office for Communications","15550","Source: LIE yearly statistics report.","Office for Communications","15983","Source: LIE yearly statistics report.","Office for Communications","15250","Source: LIE yearly statistics report.","Office for Communications","13595","","Office for Communications","14416","","","15016","","","15610","","Office for Communications.","15696","","Office for Communications","15935","","Office for Communications","16253","","Office for Communications","16712","Estimate. The exact figure will be available in the ITU-WTI Long questionnaire.","Office for Communications","17173","","Office for Communications"
"Fixed-broadband subscriptions","Lithuania","","","","2427","","Lithuanian Telecom.","20000","","Communications Regulatory Authority.","66790","","Communications Regulatory Authority.","129051","","Communications Regulatory Authority.","234081","","Communications Regulatory Authority.","368715","","Communications Regulatory Authority.","559036","","Communications Regulatory Authority.","590103","","Communications Regulatory Authority of the Republic of Lithuania","633779","","Communications Regulatory Authority of the Republic of Lithuania","679321","","Communications Regulatory Authority of the Republic of Lithuania","727699","","Communications Regulatory Authority of the Republic of Lithuania","768861","","Communications Regulatory Authority of the Republic of Lithuania","836200","","Communications Regulatory Authority of the Republic of Lithuania","801863","The number of subscriptions in 2014 went down because from 2014 WiFi services that are used as add-on to subscriptions to other internet access services are no longer included.","Communications Regulatory Authority of the Republic of Lithuania","833298","","Communications Regulatory Authority of the Republic of Lithuania","857761","","Communications Regulatory Authority of the Republic of Lithuania","798769","The migration of broadband Internet access subscribers; who used services through WIMAX wireless technology; to LTE platform led to the decrease in the number of subscribers who use fixed-line technologies (wired) in 2017.","The Communications Regulatory Authority of the Republic of Lithuania","788743","","The Communications Regulatory Authority of the Republic of Lithuania","791826","","The Communications Regulatory Authority of the Republic of Lithuania"
"Fixed-broadband subscriptions","Luxembourg","","","","1215","","Institut Luxembourgeois de Régulation.","5827","","Institut Luxembourgeois de Régulation.","15351","","Institut Luxembourgeois de Régulation.","36500","","Institut Luxembourgeois de Régulation.","70100","","Institut Luxembourgeois de Régulation.","98930","","OECD.","128680","","Institut Luxembourgeois de Régulation.","143200","","Institut Luxembourgeois de Régulation.","156120","","Institut Luxembourgeois de Régulation","168368","","Institut Luxembourgeois de Régulation","169753","","Institut Luxembourgeois de Régulation","169700","","Institut Luxembourgeois de Régulation","176500","","Institut Luxembourgeois de Régulation","186800","Incl. non-residential customers (ca 25'000).","Institut Luxembourgeois de Régulation","195300","Incl. non-residential customers (ca 49'000).","Institut Luxembourgeois de Régulation","203100","","ILR","214600","","Institut Luxembourgeois de Régulation","224300","","Institut Luxembourgeois de Régulation","230100","","Institut Luxembourgeois de Régulation"
"Fixed-broadband subscriptions","Macao, China","3731","","","9788","","","16954","","","27774","","","45218","","","68030","","","92217","","","110498","","Bureau of Telecommunications Regulation","121569","","Bureau of Telecommunications Regulation","126142","","Bureau of Telecommunications Regulation","132081","","Bureau of Telecommunications Regulation","137661","","Bureau of Telecommunications Regulation","144596","","Bureau of Telecommunications Regulation","151796","","Bureau of Telecommunications Regulation","161498","","Bureau of Telecommunications Regulation","169939","","Bureau of Telecommunications Regulation","177959","CTT website.","ITU estimate.","186000","","ITU estimate.","193057","","ITU estimate.","","",""
"Fixed-broadband subscriptions","Madagascar","","","","","","","","","","","","","","","","","","","1361","","","2354","","Office Malagasy d'Etudes et de Regulation des Télécommunications.","3488","","Office Malagasy d'Etudes et de Regulation des Télécommunications.","4576","","Office Malagasy d'Etudes et de Regulation des Télécommunications.","5391","","ITU; based on number of dsl and other fixed broadband lines.","6852","","Office Malagasy d'Etudes et de Regulation des Télécommunications","31077","","Office Malagasy d'Etudes et de Regulation des Télécommunications","37988","","Office Malagasy d'Etudes et de Regulation des Télécommunications","24835","","Autorité de Régulation des Technologies de Communication","23694","","Autorité de Régulation des Technologies de Communication","26385","","Autorité de Régulation des Technologies de Communication","25062","","Autorité de Régulation des Technologies de Communication","27211","","Autorité de Régulation des Technologies de Communication","","",""
"Fixed-broadband subscriptions","Malawi","","","","","","","","","","69","","","138","","","404","","","","","","934","","Malawi Communications Regulatory Authority.","986","MACRA","Malawi Communications Regulatory Authority","1034","","Malawi Communications Regulatory Authority","1085","","Malawi Communications Regulatory Authority","1730","","Malawi Communications Regulatory Authority","1238","","Malawi Communications Regulatory Authority","8777","","Malawi Communications Regulatory Authority","8561","","Malawi Communications Regulatory Authority","5855","","Malawi Communications Regulatory Authority","8692","","Malawi communications regulatory authority","10816","","Malawi communications regulatory authority","11358","","Malawi communications regulatory authority","11358","","Malawi communications regulatory authority"
"Fixed-broadband subscriptions","Malaysia","","","","4000","","","19302","","","110402","","","252500","","","483100","","","751000","","","1035200","","SKMM.","1329300","","Malaysian Communications and Multimedia Commission","1553600","","Malaysian Communications and Multimedia Commission","2097800","","Malaysian Communications and Multimedia Commission","2506700","","Malaysian Communications and Multimedia Commission","2920900","","Malaysian Communications and Multimedia Commission","2938800","","Malaysian Communications and Multimedia Commission","3061000","","Malaysian Communications and Multimedia Commission","3063800","","Malaysian Communications and Multimedia Commission","2718800","","Malaysian Communications and Multimedia Malaysia","2687800","","Malaysian Communications and Multimedia Commission","2696000","","Malaysian Communications and Multimedia Commission","2964500","","Malaysian Communications and Multimedia Commission"
